キャラ番号,キャラ名,プロンプト,プロンプト強調,プロンプト2,キャラLora,ネガティブ,目の色,メモ,URL,Lora作者名
137,駒草,"komakusa sannyo,purple hair, ponytail,long hair,yellow ribbon, red eyes,japanese clothes,red kimono,long sleeves,wide sleeves, purple skirt,",,,<lora:KomakusaSannyo:0.7>,,,,https://civitai.com/models/251220/komakusa-sannyo-touhou-project,kozue
138,魅須丸,"tamatsukuri misumaru,tiara,blonde hair,brown hair, multicolored hair,short hair,brown eyes, orb,jewelry,gem, magatama, rainbow orde,red vest,white shirt,puffy short sleeves, orange skirt, sash,",,,<lora:TamatsukuriMisumaru:0.8>,,,,https://civitai.com/models/251225/tamatsukuri-misumaru-touhou-project,kozue
139,典,"kudamaki tsukasa, fox,girl,fox ears, blonde hair, short hair,yellow eyes,ribbon, green ribbon,mandarin collar, short sleeves,white romper,fox tail,",,,<lora:TsukasaKudamaki:0.7>,,,,https://civitai.com/models/251231/kudamaki-tsukasa-touhou-project,kozue
140,龍,"iizunamaru megumu,tokin hat, long hair,blue hair,red eyes,shoulder armor,single pauldron, gem,sleeveless coat,black coat, dress,frilled dress,ribbon trim,pom pom (clothes),",,,<lora:IizunamaruMegumu:0.7>,,,,https://civitai.com/models/251228/iizunamaru-megumu-touhou-project,kozue
141,千亦,"Tenkyuu Chimata, multicolored hairband,multicolored dress,zipper lines (clothes),cape,cloud print,brown bag belt,pink boots",,,"<lora:Tenkyuu_Chimata_v2.0:0.7:0.7:lbw=1,0,0,0,0,0,0,0,0,0,0,0,0,0,1,1,1,1,1,1,1,1,1,1,1,1>",,,,https://civitai.com/models/18187/tenkyuu-chimataprojecttouhou-project,RepU
142,百々世,"Himemushi Momoyo,patterned clothing, black shirt, green ring, orange ribbon, orange bow, black skirt",,,<lora:Himemushi_Momoyo:0.7>,,,,https://civitai.com/models/62681?modelVersionId=67250,RepU
143,尤魔,"toutetsu yuuma,white hair,short hair,curly hair,sheep horns, horn ribbon, pointy ears, earrings, sharp teeth, red eyes, jewelry, patterned clothing,red sleeves, detached sleeves, bare shoulders,blue vest,blue skirt,",,,<lora:ToutetsuYuuma:0.7>,,,,https://civitai.com/models/231823/toutetsu-yuuma-touhou-project,kozue
144,影華扇,"kasen ibaraki, kasenarm, pink hair, pink eyes, horns, manacles, tabard, puffy sleeves, short sleeves, green skirt",,,<lora:char-kasen:0.8>,animal ear,,,https://civitai.com/models/95398/kasen-ibaraki-3-in-1,momoura
145,小兎姫,"red hair,low ponytail,long hair,japanese cloth,purple kimono",,,,,,できません,,
146,エリス,"blond hair,long hair,red hairbow,devil wing,red dress",,,,,,できません,,
147,サリエル,"sariel_(touhou), toriel, silver_blue_hair, red_eyes, purple dress, emblem_on_chest, tabard, long_sleeves, hair_between_eyes, very_long_hair, wings, ((multiple wings, seraph)):2, angel wings, feathered wings, angel_with_six_wings, white wings,",,,<lora:sariel_(touhou):0.5>,,,,https://civitai.com/models/157455/sarieltouhou,TK31
148,サラ,"pink hair,(one side up),red dress, white sleeves, short sleeves",,,,,,できません,,
149,オレンジ,"red hair,long hair,yellow hat,mobcap,green dress",,,,,,できません,,
150,コンガラ,"Konngara, wide sleeves, black hair, ponytail, red kimono, long sleeves, sleeveless kimono, grey sleeve, single horn, sash, ribbon, oni horn",,,<lora:Konngara_Touhou:0.6>,,,,https://civitai.com/models/158997/konngara,Supermachoman
151,ユウゲンマガン,,,,,,,,,
152,キクリ,,,,,,,,,
153,美天,"son biten, brown eyes, solo,bare shoulders, weapon, feet, long hair,  detached sleeves, monkey tail, jewelry, staff, brown hair, tail",,,"<lora:SON_BITEN_V1-09:0.6:1:lbw=1,0,0,0,0,0,0,0,0,0,0,0,0,1,1,1,1,1,1,1,0,0,0,0,0,0>",,,,https://civitai.com/models/128394?modelVersionId=140568,JustNobodyAI
154,慧ノ子,"enoko mitsugashira, skirt, jewelry, off shoulder,",,hand snare,<lora:enoko-07:1>,,,,https://civitai.com/models/134542/enoko-mitsugashira-project-touhou,ALEKSEYR554
155,ちやり,"chiyari tenkajin,green shirt,shorts",,,<lora:chiyari_tenkajin-07:1>,,,,https://civitai.com/models/129331/chiyari-tenkajin-touhou-19-project,ALEKSEYR554
156,日狭美,"hisami yomotsu,purple dress, elbow gloves, side slit, ",,covered eyes,<lora:hisami_yomotsu-05:1>,,,covered eyesをつけ外しするギミックあり,https://civitai.com/models/132284/hisami-yomotsu-touhou-project,ALEKSEYR554
157,残無,,,,,,,,,
